{
  "schema_version": "aya-packet-inventory/v1",
  "app_id": "dev.parcelpad.example",
  "app_version": "1.0.0",
  "source_revision": "fictional-fixture-1",
  "inventory_method": "Invented independent teaching task map, not from a real released app",
  "items": [
    {
      "id": "FACT-001",
      "profiles": [
        "help",
        "creative",
        "structured",
        "translation"
      ],
      "criticality": "low",
      "source_ref": "README fictional fixture"
    },
    {
      "id": "FACT-002",
      "profiles": [
        "help",
        "creative",
        "structured",
        "translation"
      ],
      "criticality": "high",
      "source_ref": "sample fictional operation contract"
    },
    {
      "id": "FACT-003",
      "profiles": [
        "creative"
      ],
      "criticality": "low",
      "source_ref": "fictional artwork slot example"
    },
    {
      "id": "FACT-004",
      "profiles": [
        "creative"
      ],
      "criticality": "low",
      "source_ref": "fictional import flow fixture"
    },
    {
      "id": "FACT-005",
      "profiles": [
        "structured"
      ],
      "criticality": "low",
      "source_ref": "fictional schema fixture"
    },
    {
      "id": "FACT-006",
      "profiles": [
        "structured"
      ],
      "criticality": "low",
      "source_ref": "fictional recipe acceptance fixture"
    },
    {
      "id": "FACT-007",
      "profiles": [
        "translation"
      ],
      "criticality": "low",
      "source_ref": "fictional string resource fixture"
    },
    {
      "id": "FACT-008",
      "profiles": [
        "translation"
      ],
      "criticality": "medium",
      "source_ref": "fictional importer fixture"
    },
    {
      "id": "FACT-009",
      "profiles": [
        "help"
      ],
      "criticality": "low",
      "source_ref": "fictional support QA fixture"
    }
  ]
}
